1,満足度「1:満足 2:まぁまぁ満足 3:不満」は、質的データ・量的データのどちらか。,A（質的データ）,B（量的データ）,2,"順序には意味があるが、間隔に意味がない（1と2の差が2と3の差と同じとは限らない）ため「質的データ」。"
2,満足度「1:満足 2:まぁまぁ満足 3:不満」の尺度はどれか。,名義尺度,順序尺度,間隔尺度,比例尺度,2,"順序に意味があるため「順序尺度」。"
3,「通学距離（km）」は、質的データ・量的データのどちらか。,A（質的データ）,B（量的データ）,2,"数値であり、間隔と比率に意味がある（2kmは1kmの2倍）ため「量的データ」。"
4,「通学距離（km）」の尺度はどれか。,名義尺度,順序尺度,間隔尺度,比例尺度,4,"0kmを基準に比率が計算できるため「比例尺度」。"
5,「テストの点数（点）」は、質的データ・量的データのどちらか。,A（質的データ）,B（量的データ）,2,"数値であり、間隔に意味があるため「量的データ」。"
6,「テストの点数（点）」の尺度はどれか。,名義尺度,順序尺度,間隔尺度,比例尺度,3,"0点という基準はあるが、80点は40点の2倍賢いとは言えない。一般に「間隔尺度」とされる。（※比例尺度とする見方もある）"
7,「性別（1:男 2:女）」は、質的データ・量的データのどちらか。,A（質的データ）,B（量的データ）,1,"数値は分類のための記号であり、順序や量に意味がないため「質的データ」。"
8,「性別（1:男 2:女）」の尺度はどれか。,名義尺度,順序尺度,間隔尺度,比例尺度,1,"単なる分類であり、順序や量に意味がないため「名義尺度」。"
9,データベースにおいて、データの重複や余分な箇所をなくし、不具合を減らす（更新時の矛盾などを防ぐ）操作を何と呼ぶか。,正規化,初期化,最適化,構造化,1,"正規化（Normalization）と呼びます。"
10,"「学生」で、かつ「テニス」が好きな人の人数を数えるCOUNTIFS関数はどれか。","=COUNTIFS(B:B,""学生"",C:C,""テニス"")","=COUNTIF(B:B,""学生"",C:C,""テニス"")","=COUNTIFS(B:C,""学生"",""テニス"")","=COUNTIFS(B:B,""学生"")+COUNTIFS(C:C,""テニス"")",1,"=COUNTIFS(範囲1, 条件1, 範囲2, 条件2) の構文を使います。"
11,"「20代の学生」の人数を数える関数はどれか。","=COUNTIFS(B:B,""学生"",E:E,"">=20"",E:E,""<30"")","=COUNTIFS(B:B,""学生"",E:E,""20代"")","=COUNTIF(B:B,""学生"",E:E,"">=20"")","=COUNTIFS(B:B,""学生"")+COUNTIFS(E:E,"">=20"")",1,"「20代」は「20歳以上」かつ「30歳未満」という2つの条件で表現します。"
12,ある集団全体を調査したいが、それが困難な場合に、集団の一部を取り出して調べる調査を何と呼ぶか。,全数調査,標本調査,テキストマイニング,単純無作為抽出法,2,"集団の一部（標本）を調べるため「標本調査」と呼びます。"
13,標本調査に対して、ある集団全体を調査することを何と呼ぶか。,全数調査,標本調査,層別抽出法,ヒストグラム,1,"「全数調査」と呼びます。例：国勢調査。"
14,標本の抽出方法のうち、集団からランダムに（無作為に）抽出する方法を何と呼ぶか。,単純無作為抽出法,層別抽出法,全数調査,外れ値,1,"「単純無作為抽出法」と呼びます。"
15,"標本の抽出方法のうち、集団をいくつかの層（グループ）に分け、各層から均等に抽出する方法を何と呼ぶか。",単純無作為抽出法,層別抽出法,全数調査,欠損値,2,"「層別抽出法」と呼びます。例：年代別、性別ごと。"
16,"収集されたデータのうち、書き忘れなどによって数値が欠けているデータを何と呼ぶか。",外れ値,欠損値,ヒストグラム,標本調査,2,"「欠損値」と呼びます。"
17,"収集されたデータのうち、他の値と比べて極端に大きい、または小さい値を何と呼ぶか。",外れ値,欠損値,テキストマイニング,全数調査,1,"「外れ値」と呼びます。入力ミスや測定エラーの可能性があります。"
18,"データの分布を可視化するため、数値の範囲をいくつかの区間に分け、<br>各区間のデータの個数を棒グラフで表したものを何と呼ぶか。",ヒストグラム,散布図,箱ひげ図,デンドログラム,1,"「ヒストグラム（度数分布図）」と呼びます。"
19,"文章から情報を取り出す手法で、まず文章を単語で区切り、<br>その出現回数や傾向を解析するものを何と呼ぶか。",テキストマイニング,データマイニング,ヒストグラム,欠損値,1,"「テキストマイニング」と呼びます。"
20,1つの説明変数（原因）で、1つの目的変数（結果）を予測する分析手法を何と呼ぶか。,単回帰分析,重回帰分析,主成分分析,k-means法,1,"説明変数が単一（1つ）のため「単回帰分析」と呼びます。"
21,複数の説明変数（原因）で、1つの目的変数（結果）を予測する分析手法を何と呼ぶか。,単回帰分析,重回帰分析,主成分分析,2値分類,2,"説明変数が複数（重なっている）のため「重回帰分析」と呼びます。"
22,"以下のPythonコードを実行した結果はどれか。<br><br><code>print('Hello, Hibiki')</code>","Hello, Hibiki","'Hello, Hibiki'",エラーになる,Hello Hibiki,1,"文字列（' 'で囲まれたもの）がそのまま出力されます。"
23,"以下のPythonコードを実行した結果はどれか。<br><br><code>print(100+200)</code>",300,100+200,'100+200',エラーになる,1,"クォーテーション（'）で囲まれていないため、計算結果の 300 が出力されます。"
24,"以下のPythonコードを実行した結果はどれか。<br><br><code>print('10*4')</code>",40,10*4,'10*4',エラーになる,2,"クォーテーション（'）で囲まれているため、計算されず、文字列の 10*4 がそのまま出力されます。"
25,"以下のPythonコードを実行した結果はどれか。<br><br><code>print(15/2)</code>",7,7.5,7.0,8,2,"Pythonの / 演算子は、小数点以下も計算する「浮動小数点除算」を行うため 7.5 となります。"
26,"以下のPythonコードを実行した結果はどれか。<br><br><code>a = 5<br>b = 7<br>print(a+b)</code>",12,a+b,'a+b',57,1,"変数a(5)とb(7)が足し合わされ、12 が出力されます。"
27,"以下のPythonコードを実行した結果はどれか。<br><br><code>name = 'Hiroki'<br>print(name, 'さんこんにちは')</code>","Hiroki さんこんにちは","'Hiroki' 'さんこんにちは'",エラーになる,Hirokiさんこんにちは,1,"カンマ（,）で区切られた要素は、スペース区切りで連結されて出力されます。"
28,"以下のPythonコードを実行した結果はどれか。<br><br><code>sum = 0<br>for i in range(10):<br>&nbsp;&nbsp;&nbsp;&nbsp;sum = sum + i<br>print(sum)</code>",55,45,10,9,2,"range(10) は 0から9 までの数値を意味します。0+1+2+...+9 の合計は 45 です。"
29,"以下のPythonコードを実行した結果はどれか。<br><br><code>a = 10<br>if a%2 == 0:<br>&nbsp;&nbsp;&nbsp;&nbsp;print('偶数')<br>else:<br>&nbsp;&nbsp;&nbsp;&nbsp;print('奇数')</code>",偶数,奇数,エラーになる,10,1,"a%2 は「aを2で割った余り」を求めます。10%2は0であり、0==0はTrue（真）となるため if側 の「偶数」が出力されます。"
30,Pythonの比較演算子で、「aとbは等しい」を意味する記号はどれか。,=,==,!=,<=,2,"= は代入、== が「等しい」を意味する比較演算子です。"
31	天候（1:晴 2:曇 3:雨）のように、区別のための番号で順序や大きさに意味がないデータの尺度はどれか。	名義尺度	順序尺度	間隔尺度	比例尺度	1	単なる分類であり、大小関係がないため「名義尺度」。
32	徒競争の順位（1位, 2位, 3位）のように、順序は決まっているが、数値の間隔に意味がないデータの尺度はどれか。	名義尺度	順序尺度	間隔尺度	比例尺度	2	順序には意味があるが、1位と2位の差が2位と3位の差と同じとは限らないため「順序尺度」。
33	体温（℃）のように、数値の差が等間隔で意味を持つ（37℃と36℃の差は1℃）データの尺度はどれか。	名義尺度	順序尺度	間隔尺度	比例尺度	3	0℃が「何もない」状態を意味しないため、比率には意味がなく「間隔尺度」。
34	100m走のタイム（秒）のように、数値の差と共に比率にも意味がある（20秒は10秒の2倍）データの尺度はどれか。	名義尺度	順序尺度	間隔尺度	比例尺度	4	0秒を基準として比率が計算できるため「比例尺度」。
35	データベース管理システム(DBMS)が持つ、データの一貫性や整合性を保つための機能はどれか。	整合性管理	セキュリティ	排他制御	障害回復	1	データの矛盾を防ぐ「整合性管理」機能です。
36	データベース管理システム(DBMS)が持つ、不正アクセスやデータ改ざんを防ぐための機能はどれか。	整合性管理	セキュリティ	排他制御	障害回復	2	アクセス権限などを管理する「セキュリティ」機能です。
37	データベース管理システム(DBMS)が持つ、複数ユーザーが同時に同じデータを更新しようとした際に、データの矛盾を防ぐ機能はどれか。	整合性管理	セキュリティ	排他制御	障害回復	3	同時アクセスを制御する「排他制御」機能です。
38	関係データベースにおいて、「行」全体（例：図書番号100070408の図書情報全体）を指す用語はどれか。	テーブル	項目名	レコード	フィールド	3	1件分のデータを「レコード」と呼びます。
39	関係データベースにおいて、「列」の名前（例：書名、著者名）を指す用語はどれか。	テーブル	項目名	レコード	フィールド	2	各列のデータ種類を示す「項目名」（または属性名、フィールド名）です。
40	関係データベースにおいて、「表」全体（例：図書情報一覧の表）を指す用語はどれか。	テーブル	項目名	レコード	フィールド	1	行と列からなる表形式のデータを「テーブル」と呼びます。
41	SQL（関係論理演算）で、条件を満たすデータ（レコード）だけを抽出して新たな表を作る操作はどれか。	選択	射影	結合	正規化	1	条件による行の絞り込みは「選択」。
42	SQL（関係論理演算）で、表からいくつかの項目（列）を取り出して新たな表を作る操作はどれか。	選択	射影	結合	正規化	2	列の絞り込みは「射影」。
43	原因と結果に相関関係があること、原因が結果より先に生じていること、他に影響する要因がないこと。これら3つは何を立証するための規準か。	因果関係	相関関係	クラスタリング	回帰分析	1	これら3つが揃って初めて「因果関係」があると言えます。
44	データにラベルが付与されていない場合に、データ間の近さなどを指標としてデータをグループ分けする手法を何と呼ぶか。	クラスタリング	回帰分析	テキストマイニング	正規化	1	ラベルなしデータを分類するのは「クラスタリング」。
45	Pythonの演算子で、「乗算（掛け算）」を表す記号はどれか。	*	x	^	**	1	乗算は `*` （アスタリスク）を使います。
