"ID","問題文","選択肢1","選択肢2","選択肢3","選択肢4","正解番号","解説"
"78","ネイティブアドのうち、記事の下部におすすめの記事として表示される形式を何というか。","インフィード型","ペイドサーチ型","レコメンドウィジェット型","動画広告型","3","ユーザーが読んだ内容に関連する広告を表示する仕組みです。"
"79","ネイティブアドのうち、ショッピングサイト等の商品・サービスリストの中に表示される形式を何というか。","インフィード型","レコメンドウィジェット型","ペイドサーチ型","プロモートリスティング型","4","特定の商品を探しているユーザーのリスト内に広告を混ぜて表示します。"
"80","ステルスマーケティングを防止するため、ネイティブアドにおいて明示すべき表記はどれか。","ニュース","おすすめ","PR広告プロモーションなどの文言","コラム","3","広告であることを隠さず、広告主を明確にすることがルール化されています。"
"81","POSシステムにおいて、レジを通過した際に収集される販売データに含まれないものはどれか。","商品名","販売日時","販売価格","顧客の銀行口座番号","4","決済手段は管理されますが、通常、銀行口座番号そのものはPOSデータに含めません。"
"82","情報社会における知的財産権のうち、特許や意匠とは異なり、申請なしで発生する権利はどれか。","特許権","実用新案権","商標権","著作権","4","著作権は作品を作った瞬間に発生する無方式主義を採用しています。"
"83","著作権法で、作品の内容を自分の意向に反して勝手に改変されない権利を何というか。","複製権","公衆送信権","氏名表示権","同一性保持権","4","著作者人格権の一つであり、作品の質や意図を守るための権利です。"
"84","情報の要素を抜き出す行為を何というか。","可視化","構造化","抽象化","フィードバック","3","地図で建物を記号化するような、本質抽出のプロセスです。"
"85","情報を整理するための理論に基づき、情報の階層構造を作る行為はどれか。","抽象化","可視化","構造化","UIデザイン","3","論理的な分類や順序を組み立てるデザイン工程です。"
"86","情報を視覚的に表現する例として、適切なものはどれか。","詳細な仕様書の作成","売上データのCSV出力","折れ線グラフや円グラフの作成","AIアルゴリズムの構築","3","数値を面積や長さの比率に置き換える行為を指します。"
"87","AIが渋滞予測をする際、主に活用されるデータの組み合わせはどれか。","アンケート結果と画像","位置情報と移動速度の推移","接続情報とブラウザ履歴","著作権情報と個人情報","2","GPS等の位置データと時間の変化を分析して予測を行います。"
"88","AIの普及により、人間に今後求められる能力として挙げられているものは何か。","データの単純入力能力","計算の正確さ","知恵や創造力","マニュアルの暗記力","3","AIが得意なパターン処理に対し、人間は新しい価値を創出する力が重要になります。"
"89","1つの素材を複数のメディアで使い回す戦略を何と呼ぶか。","メディアミックス","クロスメディア","ワンソース・マルチユース","データマイニング","3","例えば1つのキャラクターをアニメ、ゲーム、グッズに展開することを指します。"
"90","コミュニケーションの時間的特徴において、送信と受信が同時であることを何というか。","非同期","同期（共有）","一方向","双方向","2","電話や会話のように、リアルタイムで反応が返る状態です。"
"91","1対1の人数的特徴を持ち、かつ時間の非共有（非同期）な手段はどれか。","電話","電子メール","会議","会話","2","特定の相手に対し、相手が不在でもメッセージを残せる手段です。"
"92","多対多の人数的特徴を持ち、かつ場所の共有が必要な手段はどれか。","電子掲示板","テレビ放送","対面での会議","電話","3","複数の人が1つの場所に集まって議論する形態です。"
"93","Webサイトにおいて誰にとっても使いやすい設計を目指す際の指針となる概念はどれか。","アクセシビリティとユニバーサルデザイン","SEOとデータマイニング","プロトタイプとストーリーボード","インフルエンサーマーケティング","1","特定の誰かだけでなく、すべてのユーザーへの配慮を含む概念です。"
"94","プロトタイプ制作において、開発の初期段階で手戻りを少なくする最大の理由は何か。","著作権を早く登録するため","早い段階でフィードバックを得て修正できるため","AIに自動でコードを書かせるため","法律の規制を逃れるため","2","完成後に大きな修正をするとコストがかかるため、初期の試作が有効です。"
"95","オウンドメディアとアーンドメディアの大きな違いはどこにあるか。","文字数の制限","発信者がコンテンツをコントロールできるかどうか","有料か無料か","画像があるかどうか","2","オウンドは自社管理、アーンドは他者（ユーザー）の評価に基づきます。"
"96","インフルエンサーによる情報発信が、自社のオウンドメディアより有効な場合はどのような時か。","情報を一箇所に隠したい時","自社を全く知らない層に、信頼感を持って届けたい時","法律を無視したい時","費用を全くかけたくない時","2","第三者による推奨は、自社の宣伝よりも消費者に受け入れられやすい傾向があります。"
"97","検索エンジンのクローラーに対して、画像の意味を正確に伝えるための設定はどれか。","alt属性への記述","src属性の変更","画像のファイルサイズを大きくする","画像を非表示にする","1","クローラーは画像を直接見ることが難しいため、テキスト（alt）で説明します。"
"98","読み手が使いそうな言葉や文章を意識して執筆することがSEOに繋がる理由はどれか。","検索キーワードと一致しやすくなるから","サーバーが軽くなるから","著作権が強くなるから","デザインがきれいになるから","1","ユーザーが検索窓に打ち込む言葉（ニーズ）に応えることがSEOの基本です。"
"99","ネイティブアドが広告であることを明示しなかった場合に発生するリスクは何か。","通信速度の低下","ステルスマーケティングとして社会的信用の失墜や法的規制を受ける","著作権が消滅する","SEOの順位が急上昇する","2","消費者を騙す意図があるとみなされ、ブランドイメージを大きく損ないます。"
"100","情報Ⅱの学びにおいて、情報技術を扱う上で最も大切にすべき姿勢はどれか。","技術を悪用して利益を得ること","情報を的確に活用し、社会に貢献しようとする態度","法律を無視して自由を追求すること","デザインの見た目だけを重視すること","2","高度な技術を正しく理解し、社会を良くするために使う姿勢が学習のゴールです。"
"101","情報システムにおける入力・処理・出力の例として、自動改札機で正しいものはどれか。","入力：切符の投入、処理：有効性の判定、出力：扉の開閉","入力：目的地の決定、処理：電車の運転、出力：到着","入力：切符の購入、処理：印刷、出力：手渡し","入力：SNS投稿、処理：AI分析、出力：広告表示","1","データを読み取り、ルールに従って処理し、結果を物理的な動きで出力する仕組みです。"
"102","不正アクセス禁止法において、自分のパスワードを友人に教える行為はどう扱われるか。","特に問題ない","状況により、他人のアクセスを助長する識別符号の不正提供に当たる可能性がある","著作権法違反となる","個人情報保護法違反となる","2","正当な理由なく他人のID・パスワードを第三者に教えることは禁止されています。"
"103","個人情報保護法の対象となる個人情報として不適切なものはどれか。","氏名と住所の組み合わせ","防犯カメラに映った個人の顔画像","特定の個人を識別できない統計データ（人口密度など）","マイナンバー","3","特定の個人を識別できないように加工された統計情報は、個人情報には当たりません。"
"104","情報セキュリティポリシーを全職員に周知徹底しなければならない理由はどれか。","一部の人だけが守っても、脆弱な箇所から攻撃を受けるから","法律で全職員の暗記が義務付けられているから","AIが職員を監視しやすくするため","給与の計算に必要だから","1","セキュリティは最も弱い部分（人）から破られるため、全員の意識向上が不可欠です。"
"105","コミュニケーション手段テレビ放送の時間の分類はどれか。","非共有（非同期）","共有（同期）","多対多","双方向","2","放送時間に視聴者がテレビの前にいる必要があるため、時間の共有が必要です。"
"106","情報の抽象化のデメリットとして考えられるものはどれか。","情報が多すぎて伝わらない","詳細な情報が失われること","関係性が整理されすぎること","AIが理解できなくなること","2","本質を抜き出す過程で、周辺の詳細情報は削ぎ落とされることになります。"
"107","円グラフが可視化として適している場面はどれか。","時系列の変化を見せたい時","全体における各要素の割合を見せたい時","要素同士の論理的なつながりを見せたい時","複雑な手順を説明したい時","2","面積の比率で構成比を直感的に理解させるのに向いています。"
"108","フローチャートは情報のデザイン手法のうち、主にどれに該当するか。","抽象化","可視化","構造化","UI設計","3","処理の順序や分岐という構造を整理して示すため、構造化に該当します。"
"109","AIの画像認識を応用した、自動運転車の機能はどれか。","目的地の音声入力","カメラ映像による障害物や歩行者の検知","渋滞予測のテキスト表示","給油の予約","2","周囲の状況をリアルタイムに画像として解析し、安全を確保します。"
"110","通信の高速化がキャッシュレス決済を普及させた理由として、適切なものはどれか。","決済の通信待ち時間が減り、実用的になったから","スマホの画面が大きくなったから","テレビの画質が良くなったから","法律で紙幣が禁止されたから","1","数秒で終わる通信速度が、店舗での実用性を支えています。"
"111","情報モラルが欠如した際のリスクとして、不適切なものはどれか。","他者の権利侵害","SNSでの炎上","情報の不正確な拡散","通信速度の劇的な向上","4","モラルの有無は通信速度という物理的な性能には直接影響しません。"
"112","著作権の保護期間について、原則として著作者の死後何年間保護されるか。","10年","20年","50年","70年","4","日本の現在の法律では、原則として著作者の死後70年間権利が存続します。"
"113","銀行ATMが情報システムである理由として、正しい説明はどれか。","ネットワークを介して口座データを処理・管理しているから","建物の外にあるから","24時間動いているから","画面がタッチパネルだから","1","情報の収集、通信、処理、出力を統合した仕組みだからです。"
"114","コミュニケーション手段電話の場所的特徴はどれか。","共有","非共有","1対多","非同期","2","離れた場所にいる人と話すための手段であるため、場所の非共有に分類されます。"
"115","情報デザインの目的正確に、役に立つ形で伝えるために必要な要素はどれか。","目的や受け手の状況に合わせること","できるだけ多くの色を使うこと","専門用語を並べること","自分の意見だけを強調すること","1","情報の送り手の都合ではなく、受け手を基準に考えることが重要です。"
"116","位置情報を分析することで分かる人の動きの具体例はどれか。","個人の年収の変化","どの地域にどの時間帯に人が集まっているか","メールの送信頻度","写真の加工の好み","2","エリアごとの人口密度や動線を知ることで、商業利用や災害対策に活用されます。"
"117","Web制作におけるワイヤーフレームで、まだ決定しなくてよい要素はどれか。","メニューの配置","主要なボタンの場所","画像の正確な色味や詳細なデザイン","コンテンツの並び順","3","骨組み（レイアウト）を決める段階では、装飾的な詳細は後回しにします。"
"118","ペーパープロトタイプの最大の利点はどれか。","サーバー負荷をテストできる","プログラミングなしで、誰でもすぐに形にできる","そのまま製品として販売できる","AIが学習しやすい","2","紙とペンさえあれば、開発の最初の一歩を踏み出すことができます。"
"119","アクセシビリティを考慮したWebサイトの例はどれか。","特定の最新ブラウザでしか動かないサイト","文字が小さすぎて読めないサイト","音声読み上げ機能に対応したサイト","背景と文字が同系色で見にくいサイト","3","目の不自由な方でも情報を得られるよう配慮された設計です。"
"120","SNSでアーンドメディアが重要視される理由はどれか。","自社の宣伝よりも、第三者の口コミの方が信頼されやすいから","広告費用が完全に無料だから","法律の規制を全く受けないから","デザインが固定されているから","1","消費者（ユーザー）の生の声は、現代のマーケティングにおいて高い価値を持ちます。"
"121","ステルスマーケティングを防ぐための表記PRは、どこに記載すべきか。","利用者の目に付きやすい場所","利用規約の最後の方","画像の隅に非常に小さく","全く別のページ","1","広告であることをユーザーがすぐに認識できる場所に明示する必要があります。"
"122","SEOにおけるメタディスクリプションに適切な内容を書くメリットはどれか。","検索エンジンの計算を止めるため","検索結果に表示される説明文を見て、クリック率が上がるため","法律で100文字以上と決まっているため","サーバー代が安くなるから","2","ユーザーに自分の探している情報があると確信させることができます。"
"123","ネイティブアドがユーザーに受け入れられやすい理由はどれか。","画面を覆い尽くすから","コンテンツを中断させず、自然な流れで情報が目に入るから","音が大きいから","消すのが大変だから","2","ユーザーの読書体験や視聴体験を阻害しない工夫がなされているためです。"
"124","検索エンジンで見出しタグ（h1）が重要視される理由はどれか。","文字が一番大きく表示されるから","ページの内容を端的に表す見出しであり、クローラーがテーマを理解する手がかりになるから","リンクを貼るのに必須だから","画像を保護するタグだから","2","見出しは構造上、その節やページ全体の主題を示すものだからです。"
"125","AIが画像認識で工場の製品をチェックするメリットはどれか。","人間より疲れやすく、見逃しが多い","高速かつ一定の基準で、大量の製品を自動検品できる","電気がなくても動く","コストが無限にかかる","2","人間による目視検査の負担を減らし、品質を安定させることができます。"
"126","メディアミックス戦略の一環として、マンガをアニメ化する理由は何か。","情報を一箇所に閉じ込めるため","既存のファン以外の層にも認知を広げるため","法律を守るため","印刷代を浮かせるため","2","異なるメディアの利用者層（読者と視聴者）の両方にアプローチできます。"
"127","クロスメディアの例として、最も連動性が高いものはどれか。","テレビでCMを流すだけ","CMの最後に続きはWebでと検索を促し、Webサイトへ誘導する","看板を立てるだけ","ラジオで同じ曲を流す","2","異なるメディア間をユーザーに移動させ、体験を深める手法です。"
"128","情報モラルが教育現場で重視される背景はどれか。","PCを壊さないようにするため","SNSによるトラブルや犯罪被害から自分と他者を守るため","プログラミング速度を上げるため","数学の点数を上げるため","2","技術の便利さの裏にあるリスクを回避する能力が、全市民に必要だからです。"
"129","不正アクセス禁止法で禁止されている識別符号の不正取得の例はどれか。","自分のパスワードを紙に書く","フィッシングサイトを作って他人のパスワードを入力させる","友人の誕生日にプレゼントを贈る","公共のWi-Fiを使う","2","騙したり盗み見たりして、他人のパスワードを手に入れる行為自体が禁止されています。"
"130","抽象化の手法を用いて作成されたピクトグラムが、駅や空港で多用される理由はどれか。","言葉が通じなくても、直感的に意味を伝えられるから","色がきれいだから","サイズが自由だから","法律で作ることが義務だから","1","抽象化の極致であるシンボルマークは、世界共通の言語になり得ます。"
"131","コミュニケーション手段電話の時間と場所の分類はどれか。","時間：共有、場所：非共有","時間：共有、場所：共有","時間：非共有、場所：非共有","時間：非共有、場所：共有","1","リアルタイムで話す（同期）が、場所は離れている状態です。"
"132","情報システムを活用する際、組織がセキュリティポリシーを定める最大の目的は何か。","職員を監視して楽しむため","情報の漏洩や改ざん、システムの停止などのリスクを最小化するため","紙の資料を増やすため","デザインの統一感を出すため","2","情報の機密性、完全性、可用性を維持するための管理策です。"
"133","Webサイトのユーザインターフェース（UI）が悪いために起こる現象はどれか。","通信速度が向上する","利用者が目的の情報にたどり着けず、離脱する","PCのスペックが上がる","SEOの順位が無条件に上がる","2","使い勝手の悪さは、どんなに良いコンテンツでも伝わらない原因になります。"
"134","ストーリーボードにおいて、ユーザーの感情や状況を記述する目的は何か。","プログラミングを楽にするため","サービス利用者の体験（UX）を具体的にイメージし、問題を改善するため","デザインをカラフルにするため","法律の条文を増やすため","2","ユーザーがどのタイミングで困るか、喜ぶかを予測して設計に活かします。"
"135","インフルエンサーに広告を依頼した際、ハッシュタグ#広告等を入れない場合に受ける評価はどれか。","非常に誠実な情報発信だという評価","ステルスマーケティング（ステマ）として非難や処罰の対象となる","最新のマーケティング手法として賞賛される","デザイン性が高いと評価される","2","隠蔽工作とみなされ、発信者も企業も信頼を失います。"
"136","情報セキュリティポリシーの対策基準において、サーバ室の入退室管理を定める理由はどれか。","物理的に情報を盗まれたり壊されたりするのを防ぐため","職員の運動不足を解消するため","電気代を節約するため","AIのカメラをテストするため","1","ネットワーク対策だけでなく、物理的な資産保護もセキュリティの重要項目です。"
"137","テキストマイニングを活用して、コールセンターの声を分析する目的はどれか。","通話時間を長くするため","顧客の不満や要望を抽出し、サービス改善に活かすため","社員の声をAIに変えるため","電話代を安くするため","2","膨大な応対記録から、人間が気づかない傾向を見つけ出します。"
"138","情報デザインの抽象化において、情報を削りすぎてしまった場合に起こる問題はどれか。","意味が全く伝わらなくなる","情報が多すぎて混乱する","通信速度が落ちる","著作権が発生しなくなる","1","省略と維持のバランスが重要です。削りすぎると元の意味をなさなくなります。"
"139","SEOにおけるalt属性にキーワードを入れる際、注意すべき点はどれか。","画像と関係のないキーワードを羅列しないこと","できるだけ長く書くこと","すべて英語で書くこと","隠し文字として配置すること","1","不適切なキーワードの詰め込みはスパムと判断され、評価を下げる可能性があります。"
"140","利用状況データの分析例として、コンビニの購入商品と年齢層のデータから分かることは何か。","店員の出勤時間","どの時間帯にどの層が何を求めているかという売れ筋傾向","店内の温度の変化","地域の天気予報","2","POSシステムから得られる利用状況データをマイニングし、仕入れの最適化に役立てます。"
"141","メディアミックスを行うことで、情報の発信側が得られるメリットはどれか。","情報を独占できる","各メディアの特性を活かし、重複して情報を届けることで印象を強められる","法律の適用を免れる","デザインのコストがゼロになる","2","複数の接点を持つことで、記憶の定着や購買意欲の向上を狙います。"
"144","情報デザインにおいて、色や形に意味を持たせる（例：警告は赤）理由として正しいものはどれか。","インク代を節約するため","直感的な理解を助け、誤操作や情報の見落としを防ぐため","法律で色が指定されているから","デザインを奇抜にするため","2","文化的な共通認識（シグニファイア）を利用して、伝達効率を高めます。"
"146","著作権法において保護されないものの例として適切なものはどれか。","自作のイラスト","単なる事実のデータや、アイデアそのもの","プログラムのソースコード","自分で作曲したメロディ","2","思想や感情を創作的に表現したものが著作物であり、事実やアイデアは保護対象外です。"
"147","不正アクセス禁止法における識別符号の不正取得の罰則として正しい認識はどれか。","罰則は存在しない","懲役や罰金などの刑罰が科せられる可能性がある","学校を退学になるだけである","自分のPCが没収されるだけである","2","他人の権限を盗む行為は、犯罪として厳格に処罰されます。"
"148","個人情報保護法が個人の権利だけでなく情報の有用性も考慮している理由はどれか。","情報をすべて隠すと、便利なサービスの提供や社会の発展が妨げられるから","企業の利益だけを優先するため","法律を複雑にするため","個人情報を売買するため","1","適切なルールの下で情報を活用することも、社会の利益に繋がるからです。"
"149","人工知能（AI）が得意な作業と、人間が得意な作業の組み合わせとして適切なものはどれか。","AI：単純作業やパターン認識、人間：感情理解やクリエイティブな問いの設定","AI：新しい物語の完全な創作、人間：大量データの高速計算","AI：体力的な重労働、人間：データの単純入力","AI：すべての知的作業、人間：AIの監視のみ","1","それぞれの強みを活かした協働が、これからの情報社会で求められます。"
